{
  "schemaVersion": 1,
  "dataStatus": "demo",
  "lastVerifiedAt": "2026-10-15",
  "checkInTime": "15:00",
  "checkOutTime": "12:00",
  "translations": {
    "ko": {
      "name": "송도센트럴파크호텔",
      "description": "",
      "address": "인천광역시 연수구 테크노파크로 193 (송도동 38)",
      "checkIn": "체크인은 오후 3시부터 가능합니다.",
      "checkOut": "체크아웃은 정오 12시까지입니다.\n\n퇴실 시 객실 키를 프론트에 반납해 주세요.\n\n객실 키 분실 시 키 1개당 11,000원의 분실료가 청구될 수 있습니다.\n\n체크아웃 시간을 초과하면 시간당 11,000원이 부과되며, 오후 5시 이후에는 1박 요금이 부과됩니다.",
      "breakfast": "조식은 호텔 1층 하이웨이브 레스토랑에서 제공됩니다.\n\n조식 운영시간은 오전 6시 30분부터 오전 10시까지입니다.\n\n조식 마지막 입장시간은 오전 9시 30분입니다.\n\n조식 성인 요금은 1인 35,000원입니다.\n\n조식 요금은 5~8세 어린이 1인 19,000원입니다.\n\n조식 이용 시 현장에서 객실 번호를 확인합니다.",
      "parking": "주차는 무료이며, 별도 차량 등록 없이 출입차할 수 있습니다.",
      "roomUsage": "객실 Wi-Fi 이름은 CPH_층수이며, 비밀번호 없이 이용할 수 있습니다.\n\n전자레인지와 수저, 젓가락, 나이프, 와인잔은 6층, 10층, 16층에 마련되어 있습니다.\n\n호텔 내부에 편의점은 없습니다. 호텔 정문에서 오른쪽 방향 옆 건물에 CU 편의점이 있습니다.\n\n냉방은 화장실 입구 왼쪽 벽면의 흰색 패널 또는 에어컨 리모컨으로 조절할 수 있습니다.\n\n일회용 칫솔·치약·면도기는 무료로 제공되지 않습니다. 구매는 프론트에 문의해 주세요.\n\n배달 음식을 주문하신 경우, 호텔 정문으로 들어오신 뒤 프론트 앞 선반에서 직접 수령해 주세요.\n\n배달 기사는 객실까지 배달할 수 없습니다. 배달 음식 분실에 대해 호텔은 책임지지 않습니다.\n\n소방시설 점검 중에는 경종·사이렌·비상방송이 작동할 수 있습니다.\n\n객실·비상구·복도 등 호텔 건물 내에서는 금연입니다. 흡연으로 화재 감지기가 작동할 수 있습니다.\n\n객실 내 고성방가 등 다른 투숙객에게 불편을 주는 행위는 삼가 주세요.\n\n객실 비품의 외부 반출은 금지됩니다. 객실 슬리퍼는 객실 안에서만 착용해 주세요.\n\n객실 조명은 침대 옆 스위치로 켜거나 끌 수 있습니다.",
      "notes": "호텔 대표전화: 032-310-5000\n\n객실 내 흡연 시 담배 냄새로 인한 청소비 200,000원이 별도 안내 없이 청구될 수 있습니다.\n\n투숙 중 비품이 파손되면 동일 제품 가격에 해당하는 금액을 변상해야 합니다.\n\n반려동물 동반 후 침구가 대변 또는 소변으로 오염되면 청소비 50,000원이 추가로 발생할 수 있습니다.\n\n반려동물로 인해 가구가 손상되면 해당 가구 품목별 금액이 청구될 수 있습니다.\n\n프론트에 반려동물 동반 사실을 신고하지 않은 경우 기존 추가 비용 외에 22,000원이 추가 청구될 수 있습니다.\n\n반려동물 동반 투숙은 지정된 반려동물 전용 객실에서만 가능합니다. 일반 객실에서는 반려동물과 함께 투숙할 수 없습니다. 전용 객실 예약 및 이용 조건은 프론트에 문의해 주세요.\n\n반려동물과 함께 투숙하시는 경우 프론트에 동반 사실을 반드시 알려 주세요."
    },
    "en": {
      "name": "Songdo Central Park Hotel",
      "description": "",
      "address": "193, Technopark-ro, Yeonsu-gu, Incheon, South Korea (Songdo-dong 38)",
      "checkIn": "Check-in is available from 3:00 PM.",
      "checkOut": "Check-out is by 12:00 PM (noon).\n\nPlease return your room key cards to the front desk when checking out.\n\nIf a room key card is lost, a replacement fee of KRW 11,000 per card may apply.\n\nLate check-out is charged at KRW 11,000 per hour. For check-out after 5:00 PM, a full night's room charge applies.",
      "breakfast": "Breakfast is served at the High Wave Restaurant on the first floor.\n\nBreakfast is served from 6:30 AM to 10:00 AM.\n\nThe last admission for breakfast is at 9:30 AM.\n\nBreakfast costs KRW 35,000 per adult.\n\nBreakfast costs KRW 19,000 per child aged 5–8.\n\nYour room number will be checked when you arrive for breakfast.",
      "parking": "Parking is complimentary. Vehicle registration is not required for entry or exit.",
      "roomUsage": "The guest Wi-Fi network is named CPH_ followed by your floor number. No password is required.\n\nMicrowaves, spoons, chopsticks, knives, and wine glasses are available on floors 6, 10, and 16.\n\nThere is no convenience store inside the hotel. A CU convenience store is in the adjacent building to the right of the main entrance.\n\nYou can adjust the air conditioning using the white wall panel to the left of the bathroom entrance or the air-conditioner remote control.\n\nDisposable toothbrushes, toothpaste, and razors are not provided free of charge. Please ask the front desk if you wish to purchase them.\n\nIf you order food delivery, please enter through the hotel's main entrance and collect your order from the shelf in front of the front desk.\n\nDelivery drivers cannot bring orders directly to guest rooms. The hotel is not responsible for lost food deliveries.\n\nFire alarms, sirens, or emergency announcements may sound during fire safety inspections.\n\nSmoking is prohibited inside the hotel, including guest rooms, emergency exits, and corridors. Smoke may trigger the fire detectors.\n\nPlease refrain from loud noise or other behavior that disturbs other guests.\n\nPlease do not remove room amenities or equipment from the hotel. In-room slippers must be worn inside your guest room only.\n\nYou can turn the room lights on or off using the switch beside the bed.",
      "notes": "Hotel telephone: +82-32-310-5000\n\nSmoking in a guest room may result in a KRW 200,000 cleaning fee due to tobacco odors, without additional notice.\n\nIf room equipment or amenities are damaged during your stay, you will be required to pay the equivalent replacement cost.\n\nIf a pet soils the bedding with feces or urine, an additional cleaning fee of KRW 50,000 may apply.\n\nIf furniture is damaged by a pet, charges may apply according to the damaged item.\n\nIf you stay with a pet without informing the front desk, an additional KRW 22,000 may be charged on top of any other applicable fees.\n\nPets are allowed only in designated pet-friendly rooms. Pets are not permitted in standard guest rooms. Please contact the front desk for reservations and conditions for pet-friendly rooms.\n\nIf you are staying with a pet, please inform the front desk."
    },
    "zh-CN": {
      "name": "松岛中央公园酒店",
      "description": "",
      "address": "韩国仁川广域市延寿区 Technopark-ro 193（松岛洞 38）",
      "checkIn": "入住时间为下午3:00起。",
      "checkOut": "退房时间为中午12:00之前。\n\n退房时请将房卡归还前台。\n\n如遗失房卡，可能按每张11,000韩元收取补办费用。\n\n延迟退房按每小时11,000韩元收费。下午5:00之后退房，将收取一晚房费。",
      "breakfast": "早餐在酒店一楼的 High Wave 餐厅供应。\n\n早餐供应时间为上午6:30至10:00。\n\n早餐最晚入场时间为上午9:30。\n\n成人早餐费用为每人35,000韩元。\n\n5至8岁儿童的早餐费用为每人19,000韩元。\n\n用早餐时，现场会核对您的房间号。",
      "parking": "酒店提供免费停车服务，车辆进出无需另行登记。",
      "roomUsage": "客房 Wi-Fi 名称为 CPH_ 加上所在楼层数字，无需密码。\n\n6楼、10楼和16楼备有微波炉、勺子、筷子、餐刀和葡萄酒杯。\n\n酒店内没有便利店。酒店正门右侧相邻建筑内设有 CU 便利店。\n\n可使用浴室入口左侧墙上的白色控制面板或空调遥控器调节空调。\n\n一次性牙刷、牙膏和剃须刀不免费提供。如需购买，请咨询前台。\n\n如您订购外卖，请从酒店正门进入，并在前台前方的置物架上自行领取餐食。\n\n外卖配送员不能直接送餐至客房。如外卖餐食遗失，酒店概不负责。\n\n消防设施检查期间，警铃、警报器或紧急广播可能会响起。\n\n酒店室内全面禁烟，包括客房、紧急出口和走廊。吸烟可能触发烟雾探测器。\n\n请勿在客房内大声喧哗或做出影响其他住客的行为。\n\n请勿将客房备品带出酒店。客房拖鞋仅限在房间内穿着。\n\n您可以使用床边的开关打开或关闭客房灯光。",
      "notes": "酒店电话：+82-32-310-5000\n\n在客房内吸烟可能因烟味产生200,000韩元的清洁费，且可能不另行通知。\n\n入住期间如损坏客房备品，须按同等商品的价格进行赔偿。\n\n携带宠物入住后，如宠物排泄物弄脏床上用品，可能加收50,000韩元清洁费。\n\n如宠物损坏家具，可能按受损家具的具体项目收取费用。\n\n如携带宠物入住却未向前台申报，除其他适用费用外，还可能加收22,000韩元。\n\n仅限指定的宠物友好型客房允许携带宠物入住。普通客房不允许携带宠物。有关宠物友好型客房的预订及入住条件，请咨询前台。\n\n如携带宠物入住，请务必告知前台。"
    },
    "ja": {
      "name": "松島セントラルパークホテル",
      "description": "",
      "address": "韓国 仁川広域市 延寿区 Technopark-ro 193（松島洞 38）",
      "checkIn": "チェックインは午後3時からです。",
      "checkOut": "チェックアウトは正午12時までです。\n\nチェックアウトの際は、客室のカードキーをフロントへご返却ください。\n\nカードキーを紛失された場合、1枚につき11,000ウォンの紛失料を請求する場合があります。\n\nチェックアウト時間を過ぎた場合は1時間につき11,000ウォン、午後5時以降のチェックアウトには1泊分の宿泊料金がかかります。",
      "breakfast": "朝食はホテル1階のハイウェーブレストランで提供しています。\n\n朝食の提供時間は午前6時30分から10時までです。\n\n朝食の最終入場は午前9時30分です。\n\n朝食の大人料金は1名35,000ウォンです。\n\n5～8歳のお子様の朝食料金は1名19,000ウォンです。\n\n朝食をご利用の際は、会場で客室番号を確認いたします。",
      "parking": "駐車場は無料で、入出庫の際に車両登録は不要です。",
      "roomUsage": "客室のWi-Fi名は「CPH_」の後に宿泊階の数字が付きます。パスワードは不要です。\n\n6階・10階・16階には電子レンジ、スプーン、箸、ナイフ、ワイングラスをご用意しています。\n\nホテル館内にコンビニはありません。正面玄関を出て右側の隣の建物にCUがあります。\n\nエアコンは浴室入口の左側の壁にある白いパネル、またはエアコンのリモコンで調節できます。\n\n使い捨て歯ブラシ・歯磨き粉・カミソリは無料では提供しておりません。購入をご希望の場合はフロントへお問い合わせください。\n\nフードデリバリーをご注文の場合は、ホテル正面玄関からお入りいただき、フロント前の棚でお受け取りください。\n\n配達員が客室まで直接お届けすることはできません。配達された食品の紛失について、ホテルは責任を負いかねます。\n\n消防設備の点検中は、警報ベル・サイレン・非常放送が作動する場合があります。\n\n客室・非常口・廊下など、ホテル館内は禁煙です。喫煙により火災感知器が作動する場合があります。\n\n客室内での大声や、ほかのお客様のご迷惑となる行為はお控えください。\n\n客室の備品をホテルの外へ持ち出すことは禁止されています。客室用スリッパは客室内でのみご使用ください。\n\n客室の照明はベッド横のスイッチで点灯・消灯できます。",
      "notes": "ホテル代表電話：+82-32-310-5000\n\n客室内で喫煙された場合、たばこの臭いによる清掃費200,000ウォンを別途通知なく請求する場合があります。\n\nご滞在中に備品を破損された場合は、同等品の価格相当額をご負担いただきます。\n\nペット同伴で寝具が排泄物（大便・尿）により汚れた場合、清掃費50,000ウォンが追加で発生する場合があります。\n\nペットによって家具が破損した場合、該当する家具の品目に応じた費用を請求する場合があります。\n\nペット同伴であることをフロントに申告されなかった場合、ほかの追加料金とは別に22,000ウォンを請求する場合があります。\n\nペット同伴でのご宿泊は、指定のペット同伴専用客室に限ります。一般客室へのペットの同伴はできません。専用客室のご予約やご利用条件については、フロントにお問い合わせください。\n\nペット同伴でご宿泊の際は、必ずフロントへお申し出ください。"
    }
  }
}
